{
  "$schema": "https://nebula-docs.uhg.com/docs.schema.json",
  "name": "MCOE",
  "description": "Mobile Center of Excellence — UHG mobile platform docs",
  "theme": {
    "base": "mcoe-default",
    "extends": "./theme.json",
    "switcherEnabled": false
  },
  "navigation": {
    "tabs": [
      {
        "tab": "Overview",
        "pages": [
          "index"
        ]
      },
      {
        "tab": "Developers",
        "icon": "code",
        "groups": [
          {
            "group": "Mobile CI",
            "pages": [
              "developers/mobile-ci/about-mobile-ci",
              "developers/mobile-ci/migrate-github-to-bitrise",
              {
                "group": "Mobile Workflows",
                "pages": [
                  "developers/mobile-ci/mobile-workflows",
                  "developers/mobile-ci/mobile-workflows/react-native-ci"
                ]
              }
            ]
          },
          {
            "group": "Release Management",
            "pages": [
              "developers/release-management/getting-started",
              "developers/release-management/pipeline-overview",
              {
                "group": "Manage Rollout",
                "pages": [
                  "developers/release-management/manage-rollout/create-rollout",
                  "developers/release-management/manage-rollout/settings",
                  "developers/release-management/manage-rollout/setup-checklist"
                ]
              },
              {
                "group": "Versions",
                "pages": [
                  "developers/release-management/versions/about-versions",
                  "developers/release-management/versions/create-version",
                  "developers/release-management/versions/manage-versions",
                  {
                    "group": "Pipeline Stages",
                    "pages": [
                      "developers/release-management/versions/pipeline-stages/release-candidate",
                      "developers/release-management/versions/pipeline-stages/testing",
                      "developers/release-management/versions/pipeline-stages/google-play-testing",
                      "developers/release-management/versions/pipeline-stages/approvals",
                      "developers/release-management/versions/pipeline-stages/ospo-compliance",
                      "developers/release-management/versions/pipeline-stages/app-store-review",
                      "developers/release-management/versions/pipeline-stages/google-review",
                      "developers/release-management/versions/pipeline-stages/release",
                      "developers/release-management/versions/pipeline-stages/google-release"
                    ]
                  }
                ]
              },
              "developers/release-management/troubleshooting"
            ]
          },
          {
            "group": "Bitrise Platform",
            "pages": [
              "developers/bitrise-platform",
              "developers/bitrise-platform/bitrise-access",
              "developers/bitrise-platform/onboarding"
            ]
          },
          {
            "group": "Contributing",
            "pages": [
              "developers/contributing/rollouts",
              "developers/contributing/immerse",
              "developers/contributing/enterprise-pipelines"
            ]
          }
        ],
        "pages": [
          "developers"
        ]
      },
      {
        "tab": "Product",
        "icon": "shapes",
        "pages": [
          "product"
        ]
      },
      {
        "tab": "Resources",
        "icon": "book",
        "pages": [
          "resources",
          "resources/guides",
          "resources/glossary",
          "resources/library",
          "resources/apple-developer-access",
          "resources/google-developer-access"
        ]
      },
      {
        "tab": "About ",
        "icon": "info",
        "pages": [
          "about"
        ]
      }
    ]
  },
  "navbar": {
    "links": [
      {
        "label": "Bitrise",
        "href": "https://bitrise.io",
        "icon": "external-link"
      },
      {
        "label": "Immerse",
        "href": "https://immerse.uhg.com/overview",
        "icon": "external-link"
      }
    ]
  },
  "footer": {
    "columns": [
      {
        "label": "Documentation",
        "links": [
          {
            "label": "Developers",
            "href": "/developers"
          },
          {
            "label": "Rollouts",
            "href": "/developers/release-management/getting-started"
          },
          {
            "label": "Mobile CI",
            "href": "/developers/mobile-ci/about-mobile-ci"
          }
        ]
      },
      {
        "label": "Resources",
        "links": [
          {
            "label": "Guides",
            "href": "/resources/guides"
          },
          {
            "label": "Glossary",
            "href": "/resources/glossary"
          }
        ]
      },
      {
        "label": "External",
        "links": [
          {
            "label": "Bitrise",
            "href": "https://bitrise.io"
          },
          {
            "label": "Immerse Platform",
            "href": "https://immerse.uhg.com/overview"
          }
        ]
      }
    ],
    "copyright": "© UnitedHealth Group"
  },
  "search": {
    "provider": "pagefind",
    "scopeBy": "tab"
  },
  "logo": {
    "light": "https://firebasestorage.googleapis.com/v0/b/mcoe-d.firebasestorage.app/o/dev%2F1%2Fimages%2F1e862befc15c4d9a.svg?alt=media&token=a009ad30-1777-400c-ab86-67a34289d20a",
    "dark": "https://firebasestorage.googleapis.com/v0/b/mcoe-d.firebasestorage.app/o/dev%2F1%2Fimages%2Ffd247fc1db3dab70.svg?alt=media&token=f474c5f0-3f71-45ca-b812-e9a9359b95dc"
  }
}
